{
  "code": "RPGNE1004",
  "severity": "error",
  "message": "Scene ID \"Start\" must use lowercase ASCII.",
  "location": {
    "file": "story/main.story",
    "span": {
      "start": { "offset": 3, "line": 1, "column": 4 },
      "end": { "offset": 8, "line": 1, "column": 9 }
    }
  },
  "related": [],
  "fixes": [
    {
      "title": "Change the scene ID to start",
      "applicability": "automatic",
      "edits": [
        {
          "file": "story/main.story",
          "span": {
            "start": { "offset": 3, "line": 1, "column": 4 },
            "end": { "offset": 8, "line": 1, "column": 9 }
          },
          "expectedText": "Start",
          "replacement": "start"
        }
      ]
    }
  ],
  "tags": []
}
